{
  "components": {
    "cmp-222223": {
      "x": 1302,
      "y": 2298
    },
    "cmp-222224": {
      "x": 1452,
      "y": 2298
    },
    "cmp-222225": {
      "x": 1602,
      "y": 2298
    },
    "cmp-222226": {
      "x": 1752,
      "y": 2298
    },
    "cmp-222227": {
      "x": 1902,
      "y": 2298
    },
    "cmp-222228": {
      "x": 2052,
      "y": 2298
    },
    "cmp-222229": {
      "x": 1890,
      "y": 1770
    },
    "cmp-22222a": {
      "x": 1890,
      "y": 1842
    },
    "cmp-22222b": {
      "x": 1062,
      "y": 1788
    },
    "cmp-22222c": {
      "x": 1512,
      "y": 1944
    },
    "cmp-22222d": {
      "x": 1878,
      "y": 1968
    },
    "cmp-22222e": {
      "x": 216,
      "y": 1752
    },
    "cmp-22222f": {
      "x": 492,
      "y": 1668
    },
    "cmp-22222g": {
      "x": 978,
      "y": 1638
    },
    "cmp-22222h": {
      "x": 216,
      "y": 1500
    },
    "cmp-22222j": {
      "x": 810,
      "y": 972
    },
    "cmp-22222k": {
      "x": -366,
      "y": 1986
    },
    "cmp-22222m": {
      "x": -510,
      "y": 1986
    },
    "cmp-22222n": {
      "x": -144,
      "y": 1986
    },
    "cmp-22222p": {
      "x": -144,
      "y": 1548
    },
    "cmp-22222q": {
      "x": -114,
      "y": -24
    },
    "cmp-22222r": {
      "x": 402,
      "y": -150
    },
    "cmp-22222s": {
      "x": 402,
      "y": -66
    },
    "cmp-22222t": {
      "x": -114,
      "y": 108
    },
    "cmp-22222u": {
      "x": 402,
      "y": 18
    },
    "cmp-22222v": {
      "x": 402,
      "y": 102
    },
    "cmp-22222w": {
      "x": -114,
      "y": 372
    },
    "cmp-22222x": {
      "x": 402,
      "y": 438
    },
    "cmp-22222y": {
      "x": 402,
      "y": 354
    },
    "cmp-22222z": {
      "x": -114,
      "y": 240
    },
    "cmp-222232": {
      "x": 402,
      "y": 186
    },
    "cmp-222233": {
      "x": 402,
      "y": 270
    },
    "cmp-222234": {
      "x": -102,
      "y": 942
    },
    "cmp-222235": {
      "x": -102,
      "y": 786
    },
    "cmp-222236": {
      "x": -102,
      "y": 1098
    },
    "cmp-222237": {
      "x": 246,
      "y": 888
    },
    "cmp-222238": {
      "x": 246,
      "y": 972
    },
    "cmp-222239": {
      "x": 246,
      "y": 720
    },
    "cmp-22223a": {
      "x": 246,
      "y": 804
    },
    "cmp-22223b": {
      "x": 246,
      "y": 1056
    },
    "cmp-22223c": {
      "x": 246,
      "y": 1140
    },
    "cmp-22223d": {
      "x": 390,
      "y": 888
    },
    "cmp-22223e": {
      "x": 390,
      "y": 972
    },
    "cmp-22223f": {
      "x": 390,
      "y": 720
    },
    "cmp-22223g": {
      "x": 390,
      "y": 804
    },
    "cmp-22223h": {
      "x": 390,
      "y": 1056
    },
    "cmp-22223j": {
      "x": 390,
      "y": 1140
    },
    "cmp-22223k": {
      "x": 1254,
      "y": 642
    },
    "cmp-22223m": {
      "x": 1542,
      "y": 888
    },
    "cmp-22223n": {
      "x": 1254,
      "y": 1236
    },
    "cmp-22223p": {
      "x": 1254,
      "y": 558
    },
    "cmp-22223q": {
      "x": 1542,
      "y": 1140
    },
    "cmp-22223r": {
      "x": 1254,
      "y": 1404
    },
    "cmp-22223s": {
      "x": 1254,
      "y": 726
    },
    "cmp-22223t": {
      "x": 1542,
      "y": 972
    },
    "cmp-22223u": {
      "x": 1254,
      "y": 1320
    },
    "cmp-22223v": {
      "x": 1254,
      "y": 810
    },
    "cmp-22223w": {
      "x": 1542,
      "y": 1056
    },
    "cmp-22223x": {
      "x": 1254,
      "y": 1488
    }
  },
  "hubs": {},
  "groups": [],
  "notes": [],
  "bends": {
    "net-222243": [
      {
        "x": -222,
        "y": 19
      }
    ],
    "net-222244": [
      {
        "x": -222,
        "y": 151
      }
    ],
    "net-222247": [
      {
        "x": -222,
        "y": 1350
      },
      {
        "x": 654,
        "y": 1063
      }
    ],
    "net-222248": [
      {
        "x": -222,
        "y": 416
      }
    ],
    "net-222249": [
      {
        "x": -222,
        "y": 284
      }
    ],
    "net-22224a": [
      {
        "x": -222,
        "y": 986
      }
    ],
    "net-22224b": [
      {
        "x": -222,
        "y": 830
      }
    ],
    "net-22224c": [
      {
        "x": -222,
        "y": 1142
      }
    ],
    "net-22224k": [
      {
        "x": 1440,
        "y": 1987
      }
    ],
    "net-22224m": [
      {
        "x": 714,
        "y": 1087
      }
    ],
    "net-222263": [
      {
        "x": 1302,
        "y": 1014
      },
      {
        "x": 1521,
        "y": 1014
      }
    ]
  },
  "pins": {
    "cmp-22222b": {
      "left": [
        "PWR"
      ],
      "right": [
        "D1",
        "D2",
        "D3",
        "UP",
        "D4"
      ],
      "top": [],
      "bottom": []
    },
    "cmp-22222c": {
      "left": [
        "ETH",
        "USB1",
        "PWR"
      ],
      "right": [
        "HDMI",
        "USB2"
      ],
      "top": [],
      "bottom": [
        "CAM1",
        "CAM2",
        "CAM3",
        "CAM4",
        "CAM5",
        "CAM6"
      ]
    },
    "cmp-22222d": {
      "left": [
        "HDMI",
        "USB"
      ],
      "right": [],
      "top": [],
      "bottom": []
    },
    "cmp-22222g": {
      "left": [
        "ETH",
        "PWR"
      ],
      "right": [],
      "top": [],
      "bottom": []
    },
    "cmp-22222j": {
      "left": [
        "CAN-A",
        "CAN-B",
        "PWR",
        "ETH"
      ],
      "right": [
        "AIN1",
        "AIN2",
        "AIN3",
        "AIN4",
        "ENC1",
        "ENC2",
        "ENC3",
        "ENC4",
        "DIO1",
        "DIO2",
        "DIO3",
        "DIO4"
      ],
      "top": [],
      "bottom": []
    },
    "cmp-22222k": {
      "left": [
        "CHG",
        "CAN"
      ],
      "right": [
        "MAIN"
      ],
      "top": [],
      "bottom": []
    },
    "cmp-22222m": {
      "left": [],
      "right": [
        "J1"
      ],
      "top": [],
      "bottom": []
    },
    "cmp-22222n": {
      "left": [
        "IN"
      ],
      "right": [],
      "top": [
        "OUT"
      ],
      "bottom": []
    },
    "cmp-22222p": {
      "left": [
        "L8",
        "L1",
        "L2",
        "L5",
        "L6",
        "L7",
        "L9",
        "L10"
      ],
      "right": [
        "L3",
        "L4"
      ],
      "top": [],
      "bottom": [
        "BAT"
      ]
    },
    "cmp-22222q": {
      "left": [
        "PWR"
      ],
      "right": [
        "MOT",
        "ENC",
        "ETH"
      ],
      "top": [],
      "bottom": []
    },
    "cmp-22222t": {
      "left": [
        "PWR"
      ],
      "right": [
        "MOT",
        "ENC",
        "ETH"
      ],
      "top": [],
      "bottom": []
    },
    "cmp-22222w": {
      "left": [
        "PWR"
      ],
      "right": [
        "MOT",
        "ENC",
        "ETH"
      ],
      "top": [],
      "bottom": []
    },
    "cmp-22222z": {
      "left": [
        "PWR"
      ],
      "right": [
        "MOT",
        "ENC",
        "ETH"
      ],
      "top": [],
      "bottom": []
    },
    "cmp-222234": {
      "left": [
        "PWR",
        "CAN-B",
        "CAN-A"
      ],
      "right": [
        "M1",
        "M2",
        "ENC1",
        "ENC2"
      ],
      "top": [],
      "bottom": []
    }
  }
}
